index,ages,list_price,num_reviews,piece_count,play_star_rating,prod_desc,prod_id,prod_long_desc,review_difficulty,set_name,star_rating,theme_name,val_star_rating,country,price_per_piece,amazon_rating
5127,16+,251.88,228.0,4295.0,4.2,Build London's famous Tower Bridge!,10214,"Stretching over the River Thames since 1894, the famous Tower Bridge of London, England is one of the most recognizable landmarks in the world. Now you can add this timeless classic to your LEGO world buildings collection! Designed with advanced building techniques and rare colors and elements, the Tower Bridge is complete with its iconic paired towers and a drawbridge that really opens. Fun to build and display, it locks together solidly but can be taken apart in sections for easy transport. Includes 4 miniature vehicles; a black London taxi, a traditional red double-decker bus, a yellow truck and a green automobile. Completed model measures 40"" (102 cm) long, 17"" (45 cm) high and 10"" (26 cm) wide.
Includes 4 miniature vehicles: a black London taxi, a yellow truck, green automobile and even a traditional red double-decker bus!
Features the iconic paired towers and a drawbridge that really opens and closes!
Includes unique printed shield!
Features hundreds of 1x1 slopes in tan!
Many useful arches, angular bricks in tan!
Includes 5 blue base plates and over 80 windows!
Tower Bridge is ideal for building and display - it can be taken apart in sections for easy transport!
Add this amazing landmark to your LEGO world buildings collection!
Completed model measures an impressive 40"" (102 cm) long, 17"" (45 cm) high and 10"" (26 cm) wide.",Challenging,Tower Bridge,4.8,Creator Expert,4.6,DN,0.05864493597206053,4.4
5128,16+,239.88,64.0,4163.0,3.7,Build the world’s best-known clock tower!,10253,"Get up close to Big Ben! The clock was first started on May 31st 1859, and Big Ben’s first chime rang from the 96-meter Elizabeth Tower on July 11th of the same year. This over 23” (60cm) high LEGO® interpretation of the iconic structure is a tribute to its engineering and architecture. It features a detailed facade with statues, shields and windows, and a clock tower with 4 adjustable clock dials and a removable roof allowing access to the belfry, plus buildable exterior elements including a sidewalk, lawn and a tree depicting the building’s location. This model makes a great display piece for the home or office.
Big Ben features a detailed section of the Westminster Palace and the adjoining Elizabeth Tower, 4 detailed clock dials with movable hour and minutes hands, and a sidewalk, tree and grass area depicting the building’s location.
Remove the top of the tower to access the Big Ben bell.
Put your LEGO® building skills to the test!
Special elements include 4 printed clock faces.
Rare elements include ski poles, flowers and corner plates in molded gold color, and tinted-translucent elements.
This set includes over 4,000 LEGO® pieces.
This set offers an age-appropriate building experience for ages 16+.
Big Ben measures over 23” (60cm) high, 17” (44cm) wide and 7” (20cm) deep.",Challenging,Big Ben,4.6,Creator Expert,4.6,DN,0.057621907278404993,4.2
5129,16+,179.88,53.0,2670.0,4.2,Discover the fairground’s star attraction with the Carousel!,10257,"Experience the majestic Carousel with a wealth of delightful features, including a large textile canopy, ornate reflective rounding boards with blue and gold detailing, reflective center panels, and a 2-tier deck comprising a raised boarding platform with handrail and a main platform with 5 buildable animal rides, including a white swan and 4 moving animals. Turn the crank and see the elephant, tiger, flamingo and frog move up and down as the carousel rotates. This delightful LEGO® Creator Expert model has an iconic elegance that evokes feelings of nostalgia, romance and adventure. Upgrade with LEGO Power Functions for fully motorized operation. Includes 7 minifigures.
Includes 7 minifigures: a ride operator, mom, dad, boy, girl, grandmother and a granddaughter.
The Carousel features a large textile canopy, ornate, reflective rounding boards with blue and gold detailing, reflective center panels, 2-level deck comprising a raised boarding platform with handrail and a main platform with 5 buildable animal rides, including a white swan and 4 moving animals: an elephant, tiger, flamingo and a frog.
Also features a sturdy, buildable base for easy transportation.
Buy your ticket at the booth, take the stairs to the boarding platform and choose your favorite animal ride.
Turn the crank and see the elephant, tiger, flamingo and frog move up and down as the carousel rotates.
Enjoy an ice cream, candy or a delicious hot dog as you watch the whirling carousel.
Accessory elements include a camera, ice cream, candy and a hot dog in a bun.
This set includes more than 2,660 pieces.
New-for-June-2017 decorated elements include printed tickets and printed storybook tiles.
Includes lots of molded golden elements, reflective golden labels and medium-blue/dark-blue elements.
Motorize the Carousel with the LEGO® Power Functions 8883 medium motor and 88000 AAA battery box (not included).
Collect and build an entire fairground with the LEGO® Creator Expert 10247 Ferris Wheel.
Measures over 12” (32cm) high, 14” (38cm) wide and 13” (35cm) deep.",Challenging,Carousel,4.4,Creator Expert,4.2,DN,0.06737078651685394,4.2
5130,16+,179.88,91.0,2464.0,4.9,Experience the wonderful LEGO® Creator Ferris Wheel!,10247,"LEGO® Creator Expert model has an iconic elegance that evokes feelings of nostalgia, romance and adventure. The carnival has come to town and the ice cream vendor is busy serving a long queue of excited customers as they await their first ride on the magical Ferris Wheel that towers above the fairground. Slowly turn the crank and watch as the Ferris Wheel gracefully lowers the colorful gondolas into position for boarding. Raise the boarding platform with a simple pull of the lever, open the gondola door and help the passengers aboard! Have fun building this elegant model with an authentic charm and magic that will capture your imagination. You can also motorize the Ferris Wheel with the LEGO Power Functions 8883 medium motor and 88000 AAA battery box (not included). Includes 10 minifigures: a ride operator, ice cream vendor, 4 children and 4 adults.
Includes 10 minifigures with assorted accessories: a ride operator, ice cream vendor, 4 children and 4 adults
Features a Ferris Wheel ticket kiosk, ice cream stall, a bench and assorted flower and tree elements
Ferris Wheel features decorative elements, ramps, boarding platform and 12 colorful gondolas with opening doors
Accessory elements include a pretzel, balloon, 2 ice cream cones and an ice cream scoop
Includes an amazing 2464 LEGO® elements
Climb aboard the Ferris Wheel!
Turn the crank and watch the Ferris Wheel turn
Motorize the Ferris Wheel with the LEGO® Power Functions 8883 medium motor and 88000 AAA battery box (not included)
Ferris Wheel measures over 23” (60cm) high, 21” (55cm) wide and 14” (38cm) deep",Challenging,Ferris Wheel,4.9,Creator Expert,4.7,DN,0.07300324675324675,4.1
5131,16+,167.88,177.0,2262.0,4.4,Discover hidden clues and surprises at the Detective's Office!,10246,"Discover a world of mystery and adventure with the LEGO® Creator Expert Detective’s Office! Step through the open archway and into the barbershop, where seated customers are pampered in the reflection of a large wall mirror, while next door, competitors play pool and darts beneath the comforting whir of a rotating ceiling fan. Venture to the first floor and you’ll find the detective’s office, his desk strewn with clues, a safe containing valuable evidence and a concealed wall compartment. Then visit the adjacent bathroom, featuring a classic pull-chain toilet, before taking the stairway to the well-equipped kitchen, from where you can access the roof terrace, complete with large water tower. This latest addition to the LEGO Modular Building series is packed with unsurpassed detail and hidden surprises. Easy-to-remove roof and ceilings provide access to the delightful interior, while the exterior of the building features a decorative roofline and a beautifully designed façade. Can you solve the smuggling mystery? Includes 6 minifigures with assorted accessories: Detective Ace Brickman, Al the barber, dart player, pool player, police woman and a mysterious lady in red.
Includes 6 minifigures with assorted accessories: Detective Ace Brickman, Al the barber, dart player, pool player, police woman and a mysterious lady in red
Features a pool hall, barbershop, detective’s office, bathroom, kitchen, water tower and a cat
Detective’s office features a desk, assorted clues, brick-built lamp, filing cabinet, fan, safe, painting, concealed wall compartment, newspaper, menu, wanted poster and a wall lamp
Pool hall features a hinged, rotatable ceiling fan, pool table, printed dartboard, pool cues, pool balls and a drinking glass
Barbershop features never-before-seen scissors and reflective mirror element, 2 wall lamps, barber’s chair, hinged cabinet, 2 mannequin heads and a broom
Bathroom features a detailed pull-chain toilet
Kitchen features a stove, barrel, table, cabinet, refrigerator, wall clock and a rolling pin
Accessories include Ace Brickman’s brimmed hat, briefcase, magnifying glass and a police hat
Detach the roof and floorsfor easy access
Search for hidden clues
Help Ace Brickman solve the mystery!
Special elements include never-before-seen scissors and reflective mirror element, printed dartboard, wanted poster, 1x1 round plate with hole in black, painter’s roller in black, designing element 1x2x2 in dark gray, 1x2 bricks in light blue, 1x3 tiles in brown and a 32x32 base plate in brown
Detective’s Office measures over 10” (27cm) high, 9” (25cm) wide and 9” (25cm) deep
Collect and build an entiretown with the LEGO® Creator Expert Modular Building series: 10232 Palace Cinema and 10243 Parisian Restaurant",Challenging,Detective’s Office,4.6,Creator Expert,4.4,DN,0.07421750663129974,Error 2
5132,16+,167.88,115.0,2382.0,4.5,Make a safe deposit at the Brick Bank!,10251,"Make a secure deposit at the highly respected Brick Bank, featuring an array of intricate details and hidden surprises. Easy-to-remove building sections provide access to the detailed interior, comprising a bank with an atrium foyer, tiled floor, arched windows, ornate chandelier, lockable vault and a transaction counter with security glass; a laundrette with printed window, tiled floor and 4 washing machines; plus 2 second-floor offices with an array of detailed furniture, fixtures and accessories. The exterior of the building features a detailed sidewalk and an elaborate façade with carving and statue décor, decorative roofline, large arched windows, central balcony, clock and an accessible roof terrace featuring a large skylight. Collect and build an entire town with the LEGO® Creator Expert Modular Building series 10243 Parisian Restaurant and 10246 Detective's Office. Includes 5 minifigures: a bank manager, secretary, cashier, Mum and child.
Includes 5 minifigures: a bank manager, secretary, teller, and a mom and child.
The Brick Bank features a bank, secretary's office, bank manager's office, laundromat and a detailed façade and sidewalk.
Bank features an atrium foyer with wide, arched entrance, triangular-patterned floor tiling, ornate chandelier, oxidized-copper colored skylight, transaction counter with hidden alarm buttons and security glass, and a bank vault with safe deposit boxes and a large round door.
Laundromatfeatures a printed window, tiled floor and 4 laundry machines.
Secretary's office features a wall clock, desk, typewriter, cabinet with opening drawers, fireplace and an espresso machine.
Bank manager's office features a large desk with banker's lamp and approval stamp, leather-look chair, printed portrait, statue and a cabinet.
Accessory elements include a mug, document, camera, candy, blank white paper, chrome-golden coins, 1 chrome- golden bar and banknotes.
Remove the building sections to access the detailed interior.
Unlock the bank vault to access the safe deposit boxes.
Visit the laundromat for a spot of laundering.
Stack coins with the coin counting machine.
With over 2380 pieces, this model will put your LEGO® building skills to the test!
Special elements include a printed prize check, printed ground-floor windows, a special printed portrait in the bank manager's office, plus rare, sand-blue and dark-green bricks, and sand-green window frames.
Collect and build an entire town with the LEGO® Creator Expert Modular Building series 10243 Parisian Restaurant and 10246 Detective's Office.
Brick Bank measures over 10” (26cm) high, 10” (25cm) wide and 10” (25cm) deep.",Challenging,Brick Bank,4.7,Creator Expert,4.2,DN,0.07047858942065491,4.6
5133,16+,155.88,202.0,2469.0,4.7,Have an unforgettable evening at the amazing Parisian Restaurant!,10243,"It’s very busy in the Parisian Restaurant! As a scooter zips by, inside the waiter rushes between the tables as the nervous young man gets ready to propose with the ring! It’s just as hectic behind the scenes, with the chef busily preparing the food. This beautifully detailed building is the setting for so many stories and is a great addition to the modular building series. The Parisian Restaurant has a fully-stocked, blue and white tiled kitchen with tableware as well as a cozy apartment with pull-down bed, kitchenette and fireplace. On the top floor is the artist’s room with a studio that includes a cast iron heater, easel, paintbrush and two works of art by the aspiring artist. Outside, stairs lead down to the roof terrace lined with hanging lanterns and flowers where the diners eat alfresco-style. This amazing Parisian Restaurant model even includes a facade with croissants, clams and feather details that recapture the feel of Paris. Includes 5 minifigures: chef, waiter, girl and a romantic couple.
Includes 5 minifigures: chef, waiter, girl and a romantic couple
Also includes a rat and 2 clams
Kitchen features blue and white tiled floor, lots of kitchen units and a variety of utensils
Second-floor apartment features a pull-down bed, kitchenette and fireplace
Top floor features an opening roof revealing an artist’s studio with heater, easel, paintbrush, palette and artwork
Includes lots of food items for the customers including croissants, a pie, 2 cupcakes, 2 grapes, 2 hotdogs, turkey, cheese wedges, milk carton and colored bottles
Also includes hard-to-find white croissants and bricks in olive green, dark blue and dark red
Intricate exterior details include facade with croissant detailing, bus stop, sidewalk, scooter and even a dumpster and trash can at the back
Put up the printed restaurant sign and menu to entice the customers in
Collect and build an entire town with the LEGO® Modular Buildings collection: 10224 Town Hall and 10232 Palace Cinema!
Measures over 11” (30cm) high, 9” (25cm) long and 9” (25cm) wide",Challenging,Parisian Restaurant,4.9,Creator Expert,4.7,DN,0.06313487241798299,4.6
5134,16+,119.88,53.0,1686.0,4.1,All aboard the London Bus!,10258,"Celebrate iconic design with this charming double-decker London Bus, featuring a wealth of authentic details, including a bright-red color scheme, panoramic windshield, specially made standard-tread tires, destination sign, and an open rear boarding deck with a hand pole, ticket bin, fire extinguisher and a half-spiral staircase that leads to the upper sightseeing deck. Functions include an opening hood with engine, detailed driver’s cab with a sliding door, and a removable roof and upper deck for access to the detailed interior with worn look seating and additional authentic details, including a forgotten umbrella, newspaper, empty beverage can and discarded chewing gum. Reversible transit advertising posters are also provided as printed labels with a 1950s or present-day London promotion. This LEGO® Creator Expert model has been designed to provide a challenging and rewarding building experience with a touch of nostalgia and charm.
The London Bus comes with an array of brick-built features and details, including large windows, bright red curved bodywork, panoramic windshield, reversible transit advertising posters provided as printed labels, specially made standard-tread tires and a destination sign. It also has an opening hood with engine, detailed driver’s cab with sliding door, and a removable roof and upper deck for access to the detailed interior.
Interior details include worn look seating, open rear boarding deck with a hand pole, ticket bin, fire extinguisher and a half-spiral staircase that leads to the sightseeing deck. Additional authentic detailing includes a forgotten umbrella, newspaper, empty beverage can and discarded chewing gum elements.
Choose your favorite decade with the miniature, reversible transit advertising posters, featuring a 1950s or present day London promotion.
Remove the roof and upper deck for full access to the detailed interior.
Slide open the driver’s door to access the detailed cab with panoramic windscreen.
Lift the hood to access the engine.
Special elements include a new-for-August-2017 tire with standard tread, quarter bows and arches in red, and 1x1x1 A2/3 bricks with vertical studs.
This model includes more than 1,680 pieces.
This model is scaled for shelf display alongside other models in the LEGO® Creator Expert vehicle series.
Measures over 7” (18cm) high, 13” (34cm) long and 5” (13cm) wide.",Average,London Bus,4.6,Creator Expert,4.3,DN,0.07110320284697509,4.7
5135,16+,95.88,337.0,1334.0,4.3,Road trips will never be the same again with the iconic 1962 Volkswagen T1 Camper Van,10220,"This authentic camper van is a replica of the classic Volkswagen Camper Van from 1962. Every iconic feature is here! On the outside, the terrific detailing includes 'V' shape three-way color split at the front, rounded roof and window frames, opening 'splittie' safari windshield, opening doors, iconic pop-up roof with textile curtain surround, roof rack, rear side air intake vents and lots more! The detailing is equally impressive on the inside, from the authentic VW air-cooled flat four cylinder boxer engine, front cabin bench seat, gear stick, angled dashboard and iconic spherical speedometer, to custom LEGO® features like folding rear bench seat, folding dinette table, closet with mirror and even a painting!
Features 11 windows, authentic plaid-print textile curtains and wing mirror!
Rear door opens to reveal detailed engine!
Interior also features rear bench seat that transforms into a bed, ‘Make LEGO Models, Not War’ T-shirt and rear shelf with plant!
Measures 11.8 inches (30cm) long and 5.5 inches (14cm) high!",Challenging,Volkswagen T1 Camper Van,4.7,Creator Expert,4.5,DN,0.07187406296851574,4.6
5136,16+,95.88,66.0,1167.0,4.5,Head for the beach with the VW Beetle!,10252,"Celebrate the iconic VW Beetle with this awesome LEGO® Creator Expert reproduction. This detailed model comprises a number of special features and elements that help recreate the distinctive Beetle characteristics, including an azure-blue colour scheme, curved fenders, flat windshield, VW logo, and an authentic 4-cylinder air-cooled engine and fuel tank. The accessible interior features beige-coloured, forward-tilting seats, dashboard and steering wheel, and the roof-mounted surfboard and a cooler box can be removed. This model has been designed to provide a challenging and rewarding building experience with a touch of nostalgia.
1960s VW Beetle with surfer theme features an array of brick-built details including an azure-blue color scheme, curved fenders, white rims with distinctive hubcaps, round headlights, wing-mounted turn signals and opening hood, trunk and doors.
Choose from four different license plate stickers to customize your model.
Remove the cooler box and surfboard from the roof rails.
Tilt the rear seat forward to access the storage space with fabric beach towel.
Lift the hood to access the spare tire and fuel tank.
Open the trunk to reveal the authentic, 4-cylinder air-cooled engine.
Open the doors or remove the roof section to access the detailed beige-colored interior with dashboard, steering wheel and tiltable front and back seats.
Check out the awesome brick-built details!
Special elements include a round tile with printed VW logo, arched fender elements and an updated windshield design.
This set includes over 1,000 LEGO® pieces
This set offers an age-appropriate building experience for ages 16+.
VW Beetle including surfboard and cooler measures over 5” (15cm) high, 11” (29cm) long and 4” (12cm) wide.",Average,Volkswagen Beetle,4.9,Creator Expert,4.7,DN,0.08215938303341902,4.7
5137,16+,95.88,134.0,1077.0,4.4,Take this MINI Cooper for a nostalgic drive down memory lane!,10242,"Take the iconic MINI Cooper for a drive! This beautifully crafted LEGO® brick replica of the classic MINI Cooper Mk VII is full of authentic details, from the classic green and white colour scheme with white wing mirrors and racing stripes, to the opening doors, hood and trunk, sporty fog lights, detailed engine and separate spare tire compartment. You can even remove the roof to access a tan colored interior with patterned seats, veneer-style dashboard, turning steering wheel, and moving gearshift and handbrake. And of course, no MINI Cooper would be complete without a picnic basket and blanket, the perfect accessories for a fun day in the countryside!
Features opening doors, hood and trunk, spare wheel in separate compartment, detailed engine and 2 fog lights
Accessories include a picnic basket, bottle and blanket for nostalgic picnic theme
Authentic replica of the MINI Cooper Mk VII
Classic green and white color theme with white wing mirrors and racing stripes
Lift the hood to reveal the detailed engine
Remove the roof and access the detailed interior
Go on a countryside picnic with this iconic classic! 
MINI Cooper measures over 4” (11cm) high, 9” (25cm) long and 5” (14cm) wide",Average,MINI Cooper,4.7,Creator Expert,4.5,DN,0.08902506963788301,4.6
5138,12+,71.88,142.0,898.0,3.9,Enjoy the holiday season with the Winter Toy Shop!,10249,"Welcome to the Winter Toy Shop! The holiday season has arrived and the toymaker is busy finishing off his latest creations! Outside, children ski and snowboard, and a freshly built snowman sparkles in the light that shines from the toyshop tower. Help decorate the huge tree that stands at the center of the square, play with the curious kitten on the cozy wooden bench or join in with the carolers beneath the ornate streetlamp. This charming set also features a ladder, trees in various sizes, jack-in-the-box, a toy biplane, helicopter, rocket, train, race car, truck, robot, tugboat, teddy bear and a wrapped gift. Have fun building this enchanting winter wonderland! Includes a snowman and 8 minifigures with assorted accessories: a male caroler, female caroler, a woman, 2 men, 2 boys and a girl.
Includes 8 minifigures with assorted accessories: a male caroler, female caroler, a woman, 2 men, 2 boys and a girl
Features a toyshop, large Christmas tree with decorations, ladder, bench, ornate streetlight, carrot-nosed snowman and a cat
Toyshop features a LEGO® light brick, cash register, clock, chair, table, tools and a ladder
Accessories include a wrapped gift, snowboard, skis, 5 wreaths, 2 sets of strings lights, 2 top hats, 2 carol songbooks and 10 toys, including a jack-in-the-box, a toy biplane, helicopter, rocket, train, race car, truck, robot, tugboat and a teddy bear element
Also includes trees in various sizes and snow elements
Includes 898 assorted LEGO® elements
Gather the family for some festive LEGO® building fun!
Light up the toyshop tower with the LEGO® light brick!
Decorate the Christmas tree!
Enjoy the holiday season with this fun, festive model!
Winter Toy Shop measures over 6” (17cm) high, 7” (19cm) wide and 3” (10cm) deep
Christmas tree measures over 5” (15cm) high, 4” (11cm) wide and 4” (11cm) deep",Average,Winter Toy Shop,3.8,Creator Expert,3.7,DN,0.08004454342984409,4.6
