index,ages,list_price,num_reviews,piece_count,play_star_rating,prod_desc,prod_id,prod_long_desc,review_difficulty,set_name,star_rating,theme_name,val_star_rating,country,price_per_piece,amazon_rating
5450,7-14,15.6,11.0,184.0,4.8,Speed into race action with the awesome Scuderia Ferrari SF16-H!,75879,"Power to victory with this buildable LEGO® Speed Champions version of the Scuderia Ferrari SF16-H race car, featuring wheels with rubber tires and two interchangeable race numbers so you can pretend to be different Scuderia Ferrari drivers. The set also includes a pit wall with start-finish-line, pit monitor element and checkered flag with waving function, plus wrench and walkie-talkie elements to maximize the role-play fun. Includes a minifigure.
Includes a Ferrari racing driver minifigure.
The race-ready, buildable Scuderia Ferrari SF16-H features a minifigure cockpit, wheels with rubber tires, two interchangeable race numbers, plus authentic design details and race-graphics stickers.
Swap the race numbers on the car to play as different Ferrari drivers.
Also includes a pit wall featuring a start-finish line with translucent green, orange and red light elements, pit monitor element and checkered flag with waving function.
Accessory elements include two racing driver helmets, wrench and a walkie-talkie.
This set offers an age-appropriate build and play experience for ages 7+.
Scuderia Ferrari SF16-H measures over 1” (4cm) high, 5” (14cm) long and 2” (6cm) wide.
Pit wall measures over 2” (7cm) high, 3” (9cm) wide and 3” (9cm) deep.",Easy,Scuderia Ferrari SF16-H,4.7,Speed Champions,4.7,DN,0.08478260869565217,4.6
5451,7-14,15.6,19.0,181.0,4.7,Build and drive the ultimate hyper car!,75878,"Gear up for quad-turbocharged action with this buildable LEGO® Speed Champions version of one of the world’s most exclusive hyper cars—the Bugatti Chiron. This vehicle features wheels with rubber tires, a removable windshield plus iconic and realistic details. Test your driving skills with the three included marker cones. Includes a minifigure.
Includes a racing driver minifigure.
The race-ready, buildable Bugatti Chiron features a minifigure cockpit, wheels with rubber tires, removable windshield and iconic details.
Remove the windshield to place the minifigure in the car.
Also includes three marker cones.
Includes the racing driver’s helmet accessory element.
Role-play as a mechanic and champion racing driver.
This set offers an age-appropriate build and play experience for ages 7+.
Bugatti Chiron measures over 1” (4cm) high, 5” (13cm) long and 1” (5cm) wide.",Easy,Bugatti Chiron,4.9,Speed Champions,4.8,DN,0.0861878453038674,4.3
5452,9-14,179.88,4.0,1413.0,4.0,Jump to lightspeed in the Millennium Falcon!,75212,"Travel with Han Solo, Chewbacca and their friends with the LEGO® Star Wars Kessel Run Millennium Falcon. This LEGO brick version of the iconic Corellian freighter from the Han Solo movie features a 2-minifigure cockpit with detachable canopy, 2 spring-loaded shooters, sensor dish, ramp, rotating top and bottom laser turrets with 2 gunner seats, plus a detachable escape craft. This amazing Star Wars toy also features opening hull plates for easy access to the detailed interior, which includes a cargo area with couch and Dejarik hologame table, bar, bunk, missile storage compartment, and a buildable hyperdrive with repair tools. Also includes 6 minifigures and a DD-BD droid.
Includes 6 minifigures: Han Solo, Chewbacca, Qi’ra, Lando Calrissian, Quay Tolsite and a Kessel Operations Droid, plus a DD-BD droid.
Features a 2-minifigure cockpit with detachable canopy, 2 spring-loaded shooters, sensor dish, ramp, rotating top and bottom laser turrets with 2 minifigure gunner seats, detachable escape craft and opening hull plates for easy access to the detailed interior.
Interior includes a cargo area with 2 containers, navigation computer, couch and Dejarik hologame table, a bar, bunk, missile storage compartment, and a hyperdrive with repair tools.
Weapons include 2 blaster pistols, a blaster rifle and Lando’s blaster.
Also includes electrobinoculars.
Open up the hull plates and play out adventures from the Han Solo movie inside.
Play Chewbacca at Dejarik… but remember he's a sore loser!
This LEGO® Star Wars toy is suitable for ages 9-14.
Measures over 4” (11cm) high, 18” (48cm) long and 11” (30cm) wide.",Average,Kessel Run Millennium Falcon™,4.0,Star Wars™,3.8,DN,0.1273036093418259,Error 2
5453,9-14,77.88,7.0,519.0,5.0,Evade the mighty Imperial TIE Fighter!,75211,"Engage the enemy with the LEGO® Star Wars Imperial TIE Fighter! This brick-built version of the Empire’s iconic attack craft has a highly detailed design, including sturdy wings, opening minifigure cockpit and access hatch, and 2 spring-loaded shooters. This great Star Wars toy also includes 4 minifigures, including Han Solo and his accomplice Tobias Beckett.
Includes 4 minifigures: an Imperial Pilot, Han Solo, Tobias Beckett (in Mimban Stormtrooper disguise) and a Mimban Stormtrooper.
Features a highly detailed design including sturdy wings, opening minifigure cockpit and access hatch, plus 2 spring-loaded shooters.
Weapons include a blaster pistol, blaster, blaster rifle and Tobias Beckett's 2 special blasters.
Recreate epic Han Solo movie action scenes or dream up your own.
This LEGO® Star Wars toy is suitable for ages 9-14.
Measures over 9” (23cm) high, 7” (20cm) long and 7” (19cm) wide.",Average,Imperial TIE Fighter™,4.7,Star Wars™,3.7,DN,0.15005780346820807,4.8
5454,8-12,53.88,2.0,464.0,4.0,Go on the hunt with Moloch!,75210,"Recreate action-filled scenes from the Han Solo movie with this LEGO® Star Wars Moloch’s Landspeeder set. The infamous gang leader’s vehicle features an open minifigure cockpit, storage hold at the rear and hidden wheels for a cool hover effect. This Star Wars toy also has a 6-stud rapid shooter for intense action play, and an opening cage to hold the 2 Corellian Hound figures to add an extra dimension of battling fun for any LEGO Star Wars fan!
Includes Moloch and Rebolt minifigures, plus 2 Corellian Hound figures.
Features an open minifigure cockpit, opening cage for the hounds, rear storage hold, multi-stud shooter and hidden wheels for a hover effect.
Also includes Moloch’s blaster pistol and Rebolt's whip.
Play out epic Han Solo movie chase scenes with 75209 Han Solo's Landspeeder!
This LEGO® Star Wars toy is suitable for ages 8-12.
Measures over 2” (6cm) high, 6” (16cm) long and 4” (11cm) wide.",Easy,Moloch's Landspeeder™,4.5,Star Wars™,3.5,DN,0.11612068965517242,4.6
5455,7-12,30.0,5.0,229.0,4.4,Train with Luke at Yoda’s Dagobah hideout!,75208,"Reenact an iconic LEGO® Star Wars training scene at Yoda’s Hut on Dagobah. This feature-packed set includes Yoda’s swamp home with foldout training sections, from where Luke can balance boxes and stand on one arm to demonstrate his fledgling Jedi powers. There's also a Force jump function that can be attached to the front or back of the model. Jump Luke from the roof and swing from the ‘vine' with Yoda on his back. Inside, there's a folding bed, fireplace, a selection of food and furnishing elements, plus a secret compartment under the floor. There’s even a window at the side so R2-D2 can peer in! This feature-laden Star Wars toy includes 2 minifigures.
Includes Yoda and Luke Skywalker minifigures plus an R2-D2 figure.
Features foldout training sections, a detachable Force jump function, rooftop ‘vine’ swing function and a detailed interior including folding bed, fireplace, food and furnishing elements, and a secret underfloor compartment.
Carry Yoda on Luke's back as he trains.
Balance boxes, stand on one arm, pull a cool Force jump and swing from the ‘vine' like a true Jedi!
Weapons include Yoda's staff and Luke's Lightsaber.
Accessory elements include a carrot, frying pan, bottle and a snake.
This LEGO® Star Wars toy is suitable for ages 7-12.
Measures over 4” (11cm) high, 9” (25cm) long and 4” (11cm) wide.",Easy,Yoda's Hut,4.4,Star Wars™,4.2,DN,0.13100436681222707,4.8
5456,7-12,30.0,4.0,345.0,4.5,Escape to safety with Han Solo’s Landspeeder!,75209,"Recreate high-speed LEGO® Star Wars action scenes from the Han Solo movie with Han’s Landspeeder. Featuring an open 2-minifigure cockpit, opening hood with storage compartment, removable engine, rear storage compartment with secret cargo, hidden wheels for a hover effect and 2 spring-loaded shooters, this action-packed Star Wars toy also includes a Corellian Hound figure for Han and Qi'ra to battle.
Includes Han Solo and Qi’ra minifigures, plus a Corellian Hound figure.
Features an open 2-minifigure cockpit, opening hood with ammo and accessory storage, removable engine, rear storage compartment with secret cargo, hidden wheels for a hover effect, and 2 spring-loaded shooters.
Remove the engine for a much-needed overhaul.
Also includes 2 blaster pistols.
Play out epic Han Solo movie chase scenes with 75210 Moloch's Landspeeder!
This LEGO® Star Wars toy is suitable for ages 7-12.
Measures over 1” (5cm) high, 6” (16cm) long and 3” (10cm) wide.",Easy,Han Solo's Landspeeder™,4.8,Star Wars™,4.3,DN,0.08695652173913043,4.9
5460,6-12,15.6,4.0,99.0,4.3,Patrol the Empire and enforce the rule of law!,75207,"Play out Imperial law-enforcing scenarios with this imposing LEGO® Star Wars Imperial Patrol Battle Pack. Featuring a speeder with stud shooters, an Emigration Officer, Recruitment Officer and 2 Imperial Patrol Troopers, this Star Wars toy has everything your budding Imperial officer needs to keep their Star Wars minifigure collection under control!
Includes 4 minifigures: an Imperial Recruitment Officer, Imperial Emigration Officer and 2 Imperial Patrol Troopers.
Features a speeder with a minifigure seat and 2 stud shooters.
Also includes 4 stud blasters for the minifigures.
This LEGO® Star Wars toy is suitable for ages 6-12.
Speeder measures over 1” (3cm) high, 5” (13cm) long and 1” (5cm) wide.",Very Easy,Imperial Patrol Battle Pack,5.0,Star Wars™,4.0,DN,0.15757575757575756,4.8
5461,10+,12.0,1.0,149.0,2.0,Growl like a Wookiee with a LEGO® BrickHeadz™ construction character featuring Chewbacca!,41609,"This LEGO® BrickHeadz™ 41609 Chewbacca is fun to build using colorful LEGO bricks that recreate all of his iconic details from the Star Wars saga, including matted fur and ammunition belt. He also has a detachable blaster and stands on a buildable collector's baseplate with BrickHeadz logo for easy display in your home, office or anywhere you like.
Buildable LEGO® BrickHeadz™ construction character featuring Chewbacca has authentic details from the Star Wars saga, including matted fur, ammunition belt and a detachable blaster.
Each LEGO® BrickHeadz™ construction character comes with its own buildable collector's baseplate.
Have fun growing your LEGO® BrickHeadz™ collection with other characters from the Star Wars saga, and many more from your favorite TV series, games and comics.
Chewbacca toy stands over 2” (7cm) tall without baseplate.
Baseplate measures over 1” (4cm) square.",Very Easy,Chewbacca™,3.0,BrickHeadz,4.0,DN,0.08053691275167785,4.7
5462,10+,12.0,1.0,141.0,2.0,Be a rogue with a LEGO® BrickHeadz™ construction character featuring Han Solo!,41608,"This LEGO® BrickHeadz™ 41608 Han Solo is fun to build using colorful LEGO bricks that recreate all of his iconic details from the Star Wars saga, including a brown jacket and utility belt. He also has a detachable blaster and stands on a buildable collector's baseplate with BrickHeadz logo for easy display in your home, office or anywhere you like.
Buildable LEGO® BrickHeadz™ construction character featuring Han Solo has authentic details from the Star Wars saga, including an iconic brown jacket, utility belt and a detachable blaster.
Each LEGO® BrickHeadz™ construction character comes with its own buildable collector's baseplate featuring the BrickHeadz logo.
Have fun growing your LEGO® BrickHeadz™ collection with other characters from the Star Wars saga, and many more from your favorite TV series, games and comics.
Han Solo model stands over 2” (7cm) tall without baseplate.
Baseplate measures over 1” (4cm) square.",Very Easy,Han Solo™,4.0,BrickHeadz,4.0,DN,0.0851063829787234,4.9
5463,14+,539.88,84.0,4016.0,4.5,Win the battle for the Empire with the awesome Death Star!,75159,"Reenact amazing scenes from the Star Wars saga with the Empire’s ultimate planet-zapping weapon—the Death Star! With over 4,000 pieces, this fantastic model has a galaxy of intricate and authentic environments, including a superlaser control room, Imperial conference chamber, hangar bay with moving launch rack and Lord Vader’s TIE Advanced with space for Vader inside, Emperor Palpatine’s throne room, Droid maintenance room, detention block, trash compactor, tractor beam, cargo area, turbo laser with spring-loaded shooters and seats for the 2 Death Star Gunners, and 2 movable turbo laser towers. This fantastic set also includes 23 iconic minifigures and 2 Droids to ensure hours of Star Wars battle fun.
Includes 23 minifigures: Grand Moff Tarkin, Darth Vader, Emperor Palpatine, Imperial Navy Officer, Imperial Officer, 2 Stormtroopers, 2 Death Star Troopers, 2 Emperor's Royal Guards, 2 Death Star Gunners, Death Star Droid, Obi-Wan Kenobi, Chewbacca, Princess Leia, C-3PO, Han Solo, Han Solo (disguise), Luke Skywalker (Tatooine), Luke Skywalker (disguise) and Luke Skywalker (final duel), plus R2-D2, an Imperial Astromech and a Dianoga trash compactor monster.
Features a superlaser control room, Imperial conference chamber, hangar bay with moving launch rack and detachable TIE Advanced with space for Lord Vader inside, Emperor Palpatine’s throne room, Droid maintenance room, detention block, trash compactor, tractor beam, cargo area, turbo laser with spring-loaded shooters and seats for the 2 Death Star gunners, and 2 movable turbo laser towers.
Weapons include 3 Lightsabers, 4 blasters, 3 blaster pistols, 4 blaster rifles, 2 force pikes, 2 Force Lightning elements and a bowcaster.
Load up and fire the turbo laser’s spring-loaded shooters to keep the rebels at bay.
Maneuver Lord Vader’s TIE Advanced into position and prepare for launch.
Battle the Royal Guard in the throne room and then take on Palpatine himself!
Help Leia escape from the detention block and swing to safety with Luke across the chasm!
Will Obi-Wan shut down the tractor beam and help the rebels defeat the Empire?
Can you spot the Dianoga trash compactor monster?
Recreate other unforgettable scenes from the classic Star Wars films.
The perfect addition to any LEGO® Star Wars collection.
This set offers an age-appropriate building experience for ages 14 and over.
Measures over 16” (41cm) high, and 16” (42cm) wide.",Challenging,Death Star™,3.9,Star Wars™,3.5,DN,0.13443227091633467,4.3
5464,14+,215.88,86.0,1703.0,3.3,Build the ultimate LEGO® Snowspeeder!,75144,"Collect a true Star Wars classic: the T-47 Snowspeeder. This LEGO® interpretation of the iconic airspeeder that fans will remember from Star Wars: Episode V The Empire Strikes Back has all the details you'd expect, including opening airbrakes, rotating rear gun, and an opening cockpit with space for the included Rebel Snowspeeder Pilot and Rebel Snowspeeder Gunner minifigures. This model also comes with a display stand and fact plaque, so it can take pride of place in any LEGO Star Wars collection.
Includes 2 minifigures: a Rebel Snowspeeder Pilot and a Rebel Snowspeeder Gunner.
Features intricate, authentic detailing, opening airbrakes, rotating rear gun and an opening cockpit with space for the 2 included minifigures.
Attach the Snowspeeder to the stand with fact plaque to display it.
Impress your friends with this amazing recreation of a classic Star Wars Snowspeeder.
Includes 2 blaster pistols.
Accessory elements include electrobinoculars, a Snowspeeder Pilot helmet and a Snowspeeder Gunner helmet.
Snowspeeder on display stand measures over 8” (21cm) high, 15” (39cm) long and 11” (29cm) wide, and over 4” (11cm) high without stand.",Challenging,Snowspeeder™,4.3,Star Wars™,4.1,DN,0.1267645331767469,4.7
5465,14+,203.88,201.0,1996.0,3.9,Lift off for bounty-hunting adventures in the Slave I!,75060,"Track down fugitives with legendary bounty hunter, Boba Fett™ aboard the powerful Slave I! This exclusive LEGO® Star Wars™ model features a rotating cockpit and wings for flight and landing mode, plus dual shooters and hidden blasters to repel attackers. Reenact the capture of Han Solo™ in Star Wars™: Episode V The Empire Strikes Back and take off from Bespin with the carbonite-imprisoned Rebel hero in the cargo hold. Attach the stand to display this iconic ship in characteristic upright flight. Includes 4 minifigures with weapons: Boba Fett™, Bespin Guard™, Stormtrooper™ and Han Solo™.
Build the ship of the legendary bounty hunter Boba Fett
Featured in Star Wars: Episode V The Empire Strikes Back
Includes Boba Fett, Bespin Guard, Stormtrooper, Han Solo and Han Solo in carbonite
LEGO Star Wars building toys are compatible with all LEGO construction sets for creative building
Measures over 7” high, 17” long and 14” wide in landing mode
1996 pieces – For boys and girls ages 14 years old and up",Challenging,Slave I,4.8,Star Wars™,4.5,DN,0.10214428857715431,4.6
5466,9-14,167.88,31.0,1416.0,4.6,Command the fleet with the awesome First Order Star Destroyer!,75190,"Embark on galactic Star Wars: Episode VIII adventures with the First Order Star Destroyer. This huge model features armor-like panels on the outside, transparent-element engine detailing at the back and 8 side-facing stud shooters. Open out the top panels to reveal the detailed interior, featuring a working elevator leading to Snoke’s command center with a seat and mini hologram figure, bridge with seating for the crew, conference area with buildable medical droid and BB-9E droid, and a passageway leading to a detailed control room. There’s even a carry handle to take the play action into hyperspeed! This stellar set includes 5 minifigures and 2 droids.
Includes 5 minifigures: Supreme Leader Snoke, a First Order Officer, First Order Stormtrooper Sergeant, First Order Stormtrooper and a First Order Shuttle Pilot, plus BB-9E and buildable Medical Droid figures.
Features a carry handle, armor-panel detailing, 8 side-firing stud shooters and rear engine detailing. Open-out top panels reveal a detailed interior, including a working elevator to Snoke's chamber with a mini hologram figure, bridge with seating for the crew, conference area and a passageway leading to the control room with instrument panel detailing.
Weapons include 2 blasters and 2 blaster pistols.
Open out the panels for easy play access.
Lift the elevator and seat Snoke in his chamber.
This model includes over 1,400 pieces.
Measures over 5” (14cm) high, 22” (56cm) long and 12” (32cm) wide.",Average,First Order Star Destroyer™,4.8,Star Wars™,4.4,DN,0.1185593220338983,4.6
5467,9-14,143.88,33.0,1376.0,4.1,Stride into battle with the First Order Heavy Assault Walker!,75189,"Add a fearsome walker to your LEGO® Star Wars First Order army with the Heavy Assault Walker. This awesome model, based on the walker from the blockbuster Star Wars: Episode VIII movie, features tough armor-plate detailing, posable legs, posable head with opening minifigure cockpit and spring-loaded shooters, an aimable rapid-fire stud shooter on top, and detachable canisters that can be released from the rear of the walker. There’s also a storage compartment at the side with extra stud ammo and an opening hold to the rear with space for a minifigure and extra missile ammo. This amazing set also includes 5 minifigures.
Includes 5 minifigures: Captain Poe Dameron, Rey, a Resistance Trooper, First Order Walker Driver and a First Order Stormtrooper.
Features posable legs, a posable head with opening minifigure cockpit and spring-loaded shooters, aimable rapid-fire stud shooter on top, detachable canisters at the rear and opening ammo stores at the side.
Weapons include Rey's Lightsaber, 2 blasters and a blaster pistol.
Turn the handle to aim the top-mounted rapid-fire stud shooter.
Measures over 13” (35cm) high, 13” (35cm) long and 4” (12cm) wide.",Challenging,First Order Heavy Assault Walker™,4.4,Star Wars™,3.9,DN,0.1045639534883721,4.7
5468,9-14,119.88,15.0,825.0,4.7,Play at warp speed with Obi-Wan’s Jedi Starfighter With Hyperdrive!,75191,"Speed across the galaxy with Obi-Wan’s Jedi Starfighter With Hyperdrive. This detailed LEGO® brick recreation of the ship featured in Star Wars: Attack of the Clones includes an opening minifigure cockpit, space for the R4-P17 Astromech droid top section and 2 stud shooters, while the large hyperdrive features 2 spring-loaded shooters, big engines, and a grab handle for enhanced play and quick release of the docked model. This impressive set also includes 3 minifigures and an Astromech droid figure.
Includes 3 minifigures: Obi-Wan Kenobi, Jango Fett and young Boba Fett with mini legs, plus an R4-P17 Astromech droid figure.
Features Obi-Wan’s Jedi Starfighter and a buildable hyperdrive.
Jedi Starfighter features an opening minifigure cockpit, space for the R4-P17 Astromech droid top section (with storage space for the torso inside the ship) and 2 stud shooters.
Hyperdrive features 2 spring-loaded shooters, big engines and a quick-release grab handle for enhanced play.
Dock the Starfighter with the hyperdrive and pull the trigger to release it again.
Grab the handle and zoom the model around the room.
Hyperdrive stands on any flat surface.
Relive exciting scenes in space from Star Wars: Attack of the Clones.
Jedi Starfighter measures over 3” (8cm) high, 11” (28cm) long and 4” (12cm) wide.
Hyperdrive with docked Jedi Starfighter measures over 10” (27cm) high, 11” (28cm) long and 12” (32cm) wide.",Average,Jedi Starfighter™ With Hyperdrive,4.7,Star Wars™,4.3,DN,0.14530909090909092,Error 2
5469,9-14,119.88,23.0,780.0,4.7,Set out on heroic raids with the Resistance Bomber!,75188,"Play out action-packed LEGO® Star Wars: Episode VIII missions with the Resistance Bomber. This feature-packed model includes a button-activated bomb release function, spring-loaded shooters, 2 opening rear gun turrets with space for a minifigure, elevating rear guns, a 2-minifigure front cockpit with detachable canopy and a removable top section for easy access. It can also stand on any even surface when not in use. This set includes 5 minifigures.
Includes 5 minifigures: Poe Dameron, Vice Admiral Holdo, Resistance Gunner Paige, a Resistance Bomber Pilot and a Resistance Bombardier.
Features a bomb release function with 6 bombs, 2 spring-loaded shooters, 2 opening rear minifigure gun turrets, elevating rear guns, 2-minifigure front cockpit with detachable canopy, removable top section for easy access and a flat base.
Poe's blaster pistol also included.
Load the bombs through the top hatch and press the button to release them.
Measures over 13” (34cm) high, 15” (39cm) long and 11” (28cm) wide.",Average,Resistance Bomber,4.6,Star Wars™,4.0,DN,0.15369230769230768,4.7
5470,10-16,107.88,79.0,1106.0,4.6,Play with and display your own brick-built BB-8!,75187,"This faithfully reproduced LEGO® Star Wars incarnation of the diminutive BB-8 droid from the new Star Wars movie trilogy makes the perfect gift for any Star Wars or LEGO fan. Turn one wheel at the side to rotate the detailed head, and another to open the access hatch and extend the ‘welding torch’. This faithfully reproduced model also comes with a display stand, decorative fact plaque and small BB-8 figure, making it a great display piece for any bedroom or office.
Features authentic detailing, and wheel-activated rotating head and opening hatch with non-functioning welding torch.
Also includes a display stand, decorative fact plaque and a small BB-8 figure.
This set includes over 1,100 pieces.
BB-8 model does not roll.
BB-8 without stand measures over 9” (25cm) high and 5” (15cm) wide.
Display stand measures over 10” (26cm) long.",Average,BB-8™,4.8,Star Wars™,4.6,DN,0.09754068716094032,4.9
5471,9-14,102.0,39.0,863.0,4.2,Transport Director Krennic in his armor-plated shuttle!,75156,"Krennic’s Imperial Shuttle is an intimidating Imperial starship. Featuring huge folding wings and opening front and side panels, this amazing model also has an opening minifigure cockpit, detailed hold with seating for 4 minifigures, a rear ramp with blaster storage, dual spring-loaded shooters and retractable landing skids. Recreate epic space battles from the epic movie, Star Wars: Rogue One, or create your own. Includes 5 minifigures plus a Droid.
Includes 5 minifigures: Pao, Director Krennic, Bodhi Rook and 2 Imperial Death Troopers, plus a K-2SO.
Features huge folding wings, opening front and side armored panels, opening minifigure cockpit, seating in the hold for 4 minifigures, rear ramp with storage, dual spring-loaded shooters and retractable landing skids.
Weapons include 2 blasters for the Imperial Death Troopers, Krennic's blaster, Bodhi's blaster pistol and Pao's blaster rifle.
Accessory elements include special combatbackpacks.
Recreate fantastic scenes from the blockbuster movie, Star Wars: Rogue One.
The perfect addition to any LEGO® Star Wars collection.
This set offers an age-appropriate building experience for ages 9-14.
Measures over 17” (45cm) high, 9” (25cm) long and 22” (56cm) wide in flying mode, and over 12” (33cm) high, and 7” (18cm) wide in landing mode.",Average,Krennic's Imperial Shuttle,4.4,Star Wars™,4.4,DN,0.11819235225955968,4.7
