index,ages,list_price,num_reviews,piece_count,play_star_rating,prod_desc,prod_id,prod_long_desc,review_difficulty,set_name,star_rating,theme_name,val_star_rating,country,price_per_piece,amazon_rating
5300,4-7,30.0,,149.0,,Defend Metroville’s bank vault from the Underminer!,10760,"Fire up your child's imagination for some LEGO® Juniors The Incredibles 2 excitement, with this thrilling Underminer Bank Heist set, featuring a bank vault with breakaway door, Incredibile vehicle with Quick Start chassis, Tunneler machine with Quick Start chassis and spinning drill bits, plus a street build with brick wall, wanted poster and buildable streetlamp. This fun toy for boys and girls also includes a simple guide to build and play, to help build confidence in children ages 4-5. Includes 3 minifigures.
Includes 3 minifigures: Mrs. Incredible, Mr. Incredible and Underminer.
Features a bank vault with breakaway door and a street scene with brick wall, wanted poster and a buildable streetlamp.
Also includes 2 vehicles: an Incredibile with Quick Start chassis and a Tunneler machine with Quick Start chassis and spinning drill bits.
Spin the drill bits on the Tunneler machine and ram the vault door to break into the bank vault.
Haul off the money bills and loot with the hand truck.
Accessory elements include 2 money bills, 2 gold bar elements, diamond element, golden nugget, loot sack, trashcan, soda can, stick and a hand truck.
This thrilling toy for boys and girls is suitable for ages 4+.
Includes Easy to Build models with Quick-Start bases, plus a simple guide to get children building and playing quickly.
LEGO® Juniors sets are fully compatible with all other LEGO sets.
Tunneler measures over 1” (3cm) high, 7” (18cm) long and 2” (7cm) wide.
Incredibile measures over 1” (4cm) high, 5” (15cm) long and 2” (6cm) wide.
Bank vault measures over 3” (9cm) high, 2” (6cm) wide and 3” (8cm) deep.",,Underminer Bank Heist,,Juniors,,DN,0.20134228187919462,Error 2
5303,5-8,53.88,1.0,266.0,5.0,Race with Disney•Pixar’s Lightning McQueen for the trophy!,10745,"Start your engines and take part in the exciting Florida 500 Final Race from Disney•Pixar Cars 3, featuring an Easy to Build crew chief’s stand with raising red and green race flags and Start/Finish line arch, trackside barriers and a winners’ podium with checkered flags and a trophy. Includes a simple guide to build and play, and bigger pieces help build confidence in younger kids. LEGO® Juniors is an age-appropriate build and play experience for ages 4-7. Includes 5 LEGO Juniors characters.
Includes 5 characters from Disney•Pixar Cars 3: Lightning McQueen, Cruz Ramirez, Jackson Storm, Guido and Mack.
Features a crew chief’s stand with room for Guido, a race monitor and raising flag bars, plus a Start/Finish line arch and trackside barriers.
Also includes a winners’ podium and gas and air pump elements.
Mack can carry 2 cars inside the trailer.
Open Mack’s back to unload the cars at the racetrack.
Head to the gas pump to fuel up before the race.
Accessory elements include a trophy, tools, 2 checkered flags and red and green race flags.
Includes Easy to Build models with bigger pieces and a simple guide to get kids building and playing quickly.
Lightning McQueen measures over 1” (3cm) high, 2” (7cm) long and 1” (3cm) wide.
Cruz Ramirez measures over 1” (3cm) high, 2” (7cm) long and 1” (3cm) wide.
Jackson Storm measures over 1” (3cm) high, 2” (7cm) long and 1” (3cm) wide.
Guido measures over 1” (4cm) high, 1” (5cm) long and 1” (3cm) wide.
Mack measures over 3” (8cm) high, 9” (25cm) long and 1” (4cm) wide.
Crew chief’s stand excluding flags measures over 2” (6cm) high, 2” (6cm) wide and 3” (8cm) deep.
Start/Finish line arch measures over 4” (11cm) high, 6” (16cm) wide and 1” (4cm) deep.",Challenging,Florida 500 Final Race,5.0,Juniors,5.0,DN,0.20255639097744363,4.7
5304,4-7,36.0,2.0,191.0,5.0,Roll up for a demolition derby at the Disney•Pixar Thunder Hollow Crazy 8 Race!,10744,"Throw out the racing rulebook in this action-packed LEGO® Juniors set, featuring an Easy to Build ‘Fritter Time’ road sign with breakable barriers, ramps, flaming tires and assorted demolition derby accessories to set the pulse racing of any Disney•Pixar Cars 3 fan. Includes a simple guide to build and play, and bigger pieces help build confidence in younger kids. LEGO Juniors is an age-appropriate build and play experience for ages 4-7. Includes 4 LEGO Juniors characters.
Includes Lightning McQueen and Cruz Ramirez with mud-splash decoration, Broadside and Miss Fritter characters from Disney•Pixar Cars 3.
Features an Easy to Build ‘Miss Fritter’ road sign with movable barriers and 2 buildable floodlights.
Speed Miss Fritter through the road sign barrier and chase after Lightning McQueen and Cruz Ramirez!
Race the cars in a figure 8 pattern and bang them into the oil drums, spare tires and each other.
Includes Easy to Build models with bigger pieces and a simple guide to get kids building and playing quickly.
Accessory elements include Miss Fritter’s rotating stop sign, 3 orange road cones, 3 oil drums, 4 tires, 2 flames and assorted car parts.
Lightning McQueen measures over 2” (7cm) long, 1” (3cm) wide and over 1” (3cm) high.
Cruz Ramirez measures over 1” (3cm) high, 2” (7cm) long and 1” (3cm) wide.
Broadside measures over 1” (3cm) high, 2” (7cm) long and 1” (3cm) wide.
Miss Fritter measures over 2” (6cm) high, 3” (9cm) long and 2” (6cm) wide.
Miss Fritter road sign measures over 2” (6cm) high, 4” (12cm) wide and 3” (10cm) deep.
Floodlights measure over 3” (8cm) high, 1” (3cm) wide and under 1” (1cm) deep.",Average,Thunder Hollow Crazy 8 Race,5.0,Juniors,4.5,DN,0.18848167539267016,4.9
5305,4-7,30.0,1.0,151.0,5.0,Swoop in with Batman™ and take on the Joker™!,10753,"Suit up and join Batman™ and Robin™ as they battle The Joker™ with an Easy to Build Batwing jet, featuring shooting functions in the wings, the Joker’s wacky hotrod, plus a Batcave with docking for the Batwing, jail cell and a control center. This fun construction toy set includes a simple guide to build and play, with bigger starter pieces to help build confidence in younger children. Includes 3 minifigures.
Includes Batman™, The Joker™ and Robin™ minifigures.
Features the Batcave with viewscreen and integrated docking for the Batwing, small jail with opening door, plus a control center, as well as space for the grappling hook gun and Batarang, which can be attached to the Batcave.
Also includes the Batwing jet with shooting functions in the wings and an open cockpit, plus The Joker's hotrod with flame elements and a ball and chain element.
Connect the jail and control center to the launchpad any way you like.
Set the Batwing jet on top of the control center to dock it in the Batcave.
Push the discs through the disc shooters on the wings to launch them at The Joker™.
Use the grappling hook gun to hook onto The Joker’s mallet and take it away.
Includes Easy to Build models with bigger pieces and Quick-Start bases, plus a simple guide to get children building and playing quickly.
LEGO® Juniors sets are fully compatible with all other LEGO sets.
Weapons include Robin's grappling hook gun and The Joker’s mallet.
Accessory elements include 3 Batdiscs, a Batarang and 2 sets of dynamite.
This fun construction toy is an age-appropriate build and play experience for ages 4-7.
Batcave measures over 5” (14cm) high, 6” (17cm) wide and 3” (8cm) deep.
Batwing jet measures over 1” (5cm) high, 6” (16cm) long and 6” (16cm) wide.
The Joker's hotrod measures over 2” (7cm) high, 3” (9cm) long and 1” (5cm) wide.",Easy,The Joker™ Batcave Attack,5.0,Juniors,5.0,DN,0.1986754966887417,4.8
5306,4-7,30.0,2.0,175.0,5.0,Tear it down and build it again!,10734,"Grab your hard hat and get to work on the LEGO® City construction site, featuring Easy to Build vehicles including a dump truck, digger with rotating back arm, and a demolition crane with wrecking ball, plus a building under construction. Designed for those new to construction play, LEGO Juniors sets are age-appropriate build and play experiences for children 4-7. Includes three minifigures.
Includes three construction crew minifigures.
Features a dump truck, digger and demolition crane, plus a building under construction.
Dump truck features a minifigure cab and tilting open-box bed.
Digger features an elevating front bucket and lifting back arm, and an opening cage on the minifigure cab.
Demolition crane features a stand with a ladder at the back, rotating seat for a minifigure and a rotating arm with wrecking ball.
Building includes a door with frame, roof and wall that can be knocked down with the demolition crane.
Tilt the dump truck back to unload the building materials.
Swing the wrecking ball on the demolition crane to bring down the old building wall.
Load the dump truck with the digger.
Accessory elements include tools, two roadblock signs, cones, building bricks and a walkie-talkie.
With bigger pieces and a simple guide, these Easy to Build models get kids building and playing quickly.
This set offers an age-appropriate build and play experience for children 4-7.
Building measures over 3” (8cm) high, 1” (4cm) wide and 1” (4cm) deep.
Dump truck with open-box bed down measures over 3” (8cm) high, 5” (13cm) long and 2” (6cm) wide.
Digger with arm raised measures over 5” (13cm) high, 7” (20cm) long and 2” (6cm) wide.
Demolition crane with ball retracted measures over 5” (13cm) high, 3” (8cm) deep and 1” (5cm) wide.",,Demolition Site,5.0,Juniors,4.0,DN,0.17142857142857143,4.5
5307,4-7,27.6,2.0,116.0,5.0,Fix Disney•Pixar’s Lightning McQueen for his next exciting race!,10743,"Give Lightning McQueen a service in Smokey’s Garage after a hard day training on the racetrack. Drive the car up the ramp, change the tires, pick the tool accessories from the cabinet and role-play endless Disney•Pixar Cars 3 scenes with this fun LEGO® Juniors set. Includes a simple guide to build and play, and bigger pieces help build confidence in younger kids. LEGO Juniors is an age-appropriate build and play experience for ages 4-7. Includes Lightning McQueen, Junior Moon and Smokey LEGO Juniors characters.
Includes Lightning McQueen with his Rust-eze 95 decoration, Smokey and Junior Moon characters from Disney•Pixar Cars.
Features an Easy to Build garage set with a car ramp and yellow raised ramp, movable crane, wheeled tool kit cabinet and Smokey’s Garage sign.
Drive Lightning McQueen onto the yellow ramp and get ready for an overhaul.
Build and rebuild Lightning McQueen until he’s ready for the next racing competition!
Includes Easy to Build models with bigger pieces and a simple guide to get kids building and playing quickly.
Accessory elements include 3 spare tires and assorted tools.
All cars measure over 2” (7cm) long, 1” (3cm) wide and 1” (3cm) high.
Garage measures over 2” (7cm) high, 6” (16cm) wide and 2” (7cm) deep.
Crane measures over 3” (9cm) high, 1” (3cm) wide and 2” (6cm) deep.",Easy,Smokey's Garage,4.5,Juniors,5.0,DN,0.23793103448275862,4.6
5309,4-7,24.0,1.0,125.0,5.0,Swing into action with Spider-Man and catch the Scorpion!,10754,"Buckle up and join Spider-Man as he chases after the Scorpion in his Easy to Build Spidey-car with movable spider legs. This Spider-Man vs. Scorpion Street Showdown set also features a Scorpion car with movable pincers and tail, plus an alley wall with opening window, ramp that connects 2 ways, big web, flexible web ‘string' and a buildable catapult. The building toy set also includes a simple guide to build and play, with bigger starter pieces to help build confidence in younger children. Includes 2 minifigures.
Includes Spider-Man and Scorpion minifigures.
Features an alley wall with rooftop, satellite dish and antenna, opening window, connections for the large web element and wall climbing, plus a detachable ramp that works both ways and a small buildable catapult.
Also includes 2 vehicles – a Spidey-car with extra legs, large rear spoiler and a connector on the front and back to attach the web ‘string', and a Scorpion-car with movable pincers and tail.
Climb up the side of the alley wall to look for Scorpion’s car.
Hop in the Spidey-car and launch yourself up the ramp out of the alley to race after Scorpion.
Turn the ramp around and chase the villain back into the alley.
Launch the web ‘balls’ at Scorpion’s car before you sling the big web and stop him.
Accessory elements include 2 web ‘balls', trash can, stack of newspapers, large web element, a banana and a flexible web ‘string' that connects to the Spidey-car or Spider-Man's hand.
This exciting building toy is an age-appropriate build and play experience for ages 4-7.
Includes Easy to Build models with bigger starter pieces and Quick-Start bases, plus a simple guide to get children building and playing quickly.
LEGO® Juniors sets are fully compatible with LEGO Marvel Super Heroes franchise sets.
Alley measures over 4” (12cm) high, 3” (8cm) wide and 2” (6cm) deep.
Spidey-car measures over 1” (3cm) high, 3” (9cm) long and 2” (7cm) wide.
Scorpion car with tail raised measures over 3” (9cm) high, 4” (11cm) long and 2” (7cm) wide.",,Spider-Man vs. Scorpion Street Showdown,4.0,Juniors,4.0,DN,0.192,4.6
5310,4-7,21.6,,115.0,,Pick up some tasty organic goodies from Mia and Twister!,10749,"Start the day out right with goodies from Mia’s Organic Food Market, featuring an Easy to Build truck with Quick Start chassis, opening side and rotating sign, plus a spinning merry-go-round, stand-alone crates and a picnic table with seats. This colorful and fun toy also includes a simple guide to build and play, with bigger starter pieces to help build confidence in younger children. Includes a mini-doll figure and bunny figure.
Includes a Mia mini-doll figure and a Twister bunny figure.
Features a colorful, Easy to Build truck with Quick Start chassis, opening side, rotating sign and space inside for a mini-doll figure.
Also includes a crate, small table stand, buildable merry-go-round and a picnic table with seats.
Accessory elements include a crate, 2 carrots, 2 cherries, 3 strawberries, 2 cups, an apple, honey jar, strawberry jam jar and a money bill.
This fun toy is an age-appropriate build and play experience for ages 4-7.
Includes Easy to Build models with bigger starter pieces and Quick-Start bases, plus a simple guide to get children building and playing quickly.
All LEGO® Juniors sets are fully compatible with all other LEGO sets.
Food truck measures over 3” (8cm) high, 5” (14cm) long and 2” (7cm) wide.
Picnic table measures over 1” (3cm) high, 2” (6cm) wide and 1” (3cm) deep.
Merry-go-round measures over 3” (9cm) wide and under 1” (2cm) high and 1” (1cm) deep",,Mia's Organic Food Market,,Juniors,,DN,0.18782608695652175,4.9
5311,4-7,21.6,2.0,100.0,5.0,It’s feeding time down at the animal farm!,10746,"Jump in the pickup and drive with Mia to the LEGO® Friends farm to feed the animals, featuring a stable with opening gate, pen, wheelbarrow, hay bales and assorted food elements and farmyard tools. Help children learn to care for and nurture the animals with this easy-to-carry suitcase play set. LEGO Juniors is an age-appropriate build and play experience for ages 4-7. Includes a Mia mini-doll figure, plus foal and lamb figures.
Includes a Mia mini-doll figure, plus foal and lamb figures.
Features an Easy to Build farm pickup vehicle with rear storage area, stable with opening gate for the foal and a pen for the lamb.
Deliver food to the farm in the pickup.
Help the animals stay healthy by keeping the farm clean and tidy with the tool elements.
Keep the lamb nourished with the feeding bottle.
Open the gate to let the foal run around.
Encourage children to learn how to care for animals.
Easy to Build model with bigger pieces and a simple guide to get kids building and playing quickly.
Accessory elements include a carrot with food bin, apple, wheelbarrow, comb, feeding bottle, shovel, rake, water tap, two ribbons, red and green flowers, bowl and four hay bales.
The LEGO® Juniors suitcase lets you build and play on the move.
This set offers an age-appropriate build and play experience for ages 4-7.
Suitcase measures over 10” (26cm) high, 11” (28cm) wide and 2” (6cm) deep.
Pickup vehicle measures over 1” (4cm) high, 3” (9cm) long and 1” (4cm) wide.
Stable measures over 3” (8cm) high, 3” (9cm) wide and 4” (10cm) deep.",Easy,Mia's Farm Suitcase,5.0,Juniors,4.5,DN,0.21600000000000003,4.4
5312,4-7,21.6,2.0,95.0,2.5,Smash the speed record with Disney•Pixar’s Lightning McQueen and Sheriff!,10742,"Start your engines in this high-octane Willy’s Butte Speed Training LEGO® Juniors play set, featuring a detachable speed radar trailer, roadblock with breakable barriers, spinning Radiator Springs road sign and other accessories to ramp up the Disney•Pixar Cars 3 fun. Includes a simple guide to build and play, and bigger pieces help build confidence in younger kids. LEGO Juniors is an age-appropriate build and play experience for ages 4-7. Includes Lightning McQueen and Sheriff LEGO Juniors characters.
Includes Lightning McQueen in his training outfit decoration and Sheriff characters from Disney•Pixar Cars 3.
Features a detachable speed radar trailer with decorated counter and tow bar, and a roadblock with ramp and 2 movable barriers.
Attach the speed radar trailer’s tow bar to Sheriff and drive it into position to capture the high-speed racing action.
Push Lightning McQueen up the ramp and through the breakable roadblock barriers to create a smashing effect!
Includes Easy to Build models with bigger pieces and a simple guide to get kids building and playing quickly.
Accessory elements include a ramp, cone and a shrub.
Lightning McQueen measures over 2” (7cm) long, 1” (3cm) wide and 1” (3cm) high.
Sheriff measures over over 1” (3cm) high, 2” (7cm) long and 1” (3cm) wide.
Speed radar measures over 2” (7cm) high, 1” (4cm) wide and 1” (4cm) deep.
Ramp measures over 1” (3cm) high, 3” (8cm) wide and 4” (11cm) deep.",Easy,Willy's Butte Speed Training,3.0,Juniors,3.0,DN,0.22736842105263158,4.2
5313,4-7,21.6,,115.0,,Chase down the crook and recover the loot!,10751,"Be a hero of the LEGO® City Mountain Police Force! This cool toy for kids features an Easy to Build helicopter with opening minifigure cockpit, spinning rotors and a chain with hook, as well as a police station with desk, opening safe and jail cell with opening door, and a quad bike. This action-packed set also includes a simple guide to build and play, with bigger starter pieces to help build confidence in younger children. Includes 2 minifigures.
Includes 2 minifigures: a police officer and a crook.
Features a police station with Quick Start baseplate, desk, opening safe with space for money bills inside, a ladder to the lookout with spyglass on the roof, and a jail cell with opening door.
Also includes a helicopter with Quick Start body, opening minifigure cockpit, spinning rotors and a chain with hook, plus a quad bike with a seat for a minifigure.
Wedge the crowbar in the safe to break it open and take the money bills.
Lower the chain from the helicopter and hook the end of the quad bike to catch the crook.
Accessory elements include 2 money bills, a crowbar, sack, handcuffs, WANTED poster and a mug.
Includes Easy to Build models with bigger starter pieces and Quick-Start bases, plus a simple guide to get children building and playing quickly.
This cool toy for kids is an age-appropriate build and play experience for ages 4-7.
All LEGO® Juniors sets are fully compatible with all other LEGO sets.
Helicopter measures over 3” (8cm) high, 4” (12cm) long and 3” (10cm) wide.
Quad bike measures over 1” (4cm) high, 1” (5cm) long and 1” (5cm) wide.
Police station measures over 3” (10cm) high, 4” (12cm) wide and 2” (6cm) deep.",,Mountain Police Chase,,Juniors,,DN,0.18782608695652175,4.8
5314,4-7,21.6,2.0,108.0,4.5,Help Kai and Lloyd save NINJAGO® City from Great White!,10739,"Team up with Kai and Lloyd for some ninja fun as they battle Great White, featuring a training area with weapon stand, breakable blocks, spinning training dummy, flaming motorcycle and a shark car with flick missiles. This fun THE LEGO® NINJAGO® MOVIE™ set features a simple guide to build and play, and some bigger pieces to help build confidence in younger children. LEGO Juniors is an age-appropriate build and play experience for ages 4-7. Includes 3 minifigures.
Includes 3 minifigures: Kai, Lloyd and Great White.
Features a buildable training area with weapon stand, breakable blocks, spinning training dummy, motorbike with detachable flame and flag, and a shark car with movable fins and dual flick missiles.
Line up the blocks and break them with a katana!
Practice your katana skills on the training dummy.
Includes Easy to Build models with bigger pieces and a simple guide to get children building and playing quickly.
Weapons include 4 katanas, 2 daggers and a fish harpoon.
Also includes a basket accessory element.
Recreate and role-play fun scenes from THE LEGO® NINJAGO® MOVIE™.
Shark car measures over 2” (6cm) high, 3” (10cm) long and 2” (6cm) wide, and 3” (10cm) wide with fins extended.
Motorcycle with flame extended measures over 2” (6cm) high, 4” (12cm) long and under 1” (2cm) wide.",Easy,Shark Attack,4.5,Juniors,4.0,DN,0.2,4.7
5315,4-7,21.6,1.0,110.0,,Help the firefighters battle the blaze!,10740,"Be prepared for a LEGO® City emergency wherever you are with this fun, easy-to-carry suitcase play set, featuring a fire pickup with adjustable cherry picker and motorcycle to put out the flames of the buildable abandoned house with opening door. LEGO Juniors is an age-appropriate build and play experience for ages 4-7. Includes two minifigures.
Includes two firefighter minifigures.
Features an Easy to Build fire pickup with rear storage compartment and trailer with adjustable cherry picker, motorcycle and an abandoned house with opening door and windows.
Attach the trailer to the fire pickup and race to the abandoned house!
Place a firefighter in the cherry picker and raise it to reach the rooftop flames.
Push the flame piece through the doorway to create a spreading fire effect.
Includes Easy to Build models with bigger pieces and a simple guide to get kids building and playing quickly.
Accessory elements include four translucent-orange flames and translucent-blue water, two oxygen tanks, axe, handsaw and two fire extinguishers.
The LEGO® Juniors suitcase lets you build and play on the move!
This set offers an age-appropriate build and play experience for ages 4-7.
Suitcase measures over 10” (26cm) high, 11” (28cm) wide and 2” (6cm) deep.
Fire pickup with trailer measures over 2” (7cm) high, 7” (20cm) long and 1” (5cm) wide with cherry picker lowered, and over 7” (20cm) high, 7” (18cm) long and 1” (5cm) wide when raised.
Motorcycle measures over 1” (3cm) high, 2” (6cm) long and 1” (3cm) wide.
Abandoned house and baseplate measures over 2” (7cm) high, 2” (6cm) wide and 1” (4cm) deep.",Easy,Fire Patrol Suitcase,4.0,Juniors,,DN,0.19636363636363638,4.7
5316,4-7,21.6,,131.0,,Race against Chopper Maroon for the treasure map!,10755,"Get your ninja on and help Zane recover the map! This thrilling set features Easy to Build pieces including a floating boat with turning steering wheel and a chain with hook, a motorbike, plus a temple with spinning obstacles, secret weapons and a map. This fun children's toy also includes a simple guide to build and play, with bigger starter pieces to help build confidence in younger children. Includes 2 minifigures.
Includes Zane and Chopper Maroon minifigures.
Features a temple with ramps, a dock, spinning knives and snake obstacles, treasure map with stand and decorative staffs above the archway that double as secret weapons.
Also includes a motorbike and a boat with turning wheel, chain with hook, ice bolts and golden staff elements that double as secret weapons.
The boat floats!
Spin the snakes and knives to slow down Chopper Maroon's bike.
Connect the hook to the motorbike to stop Chopper Maroon from getting away with the map.
Place the map on the steering wheel of the boat to help lead you to the mask.
Weapons include Zane’s golden katanas and Chopper Maroon’s red katana.
Includes 2 ‘floating’ firebombs and a treasure map element.
This fun children's toy is an age-appropriate build and play experience for ages 4-7.
Includes Easy to Build models with bigger starter pieces and Quick-Start bases, plus a simple guide to get children building and playing quickly.
All LEGO® Juniors sets are fully compatible with all other LEGO sets.
Boat with golden staffs measures over 1” (4cm) high, 7” (20cm) long and 2” (6cm) wide.
Temple measures over 3” (9cm) high, 7” (19cm) wide and 3” (8cm) deep.
Motorbike measures over 1” (4cm) high, 3” (8cm) long and under 1” (2cm) wide",,Zane's Ninja Boat Pursuit,,Juniors,,DN,0.1648854961832061,4.5
